{
  "protocol_version": "0.1",
  "bundle_id": "evidence:weather:invalid-example",
  "created_at": "2032-04-05T09:05:00.000Z",
  "claims": [
    {
      "claim_id": "claim:weather",
      "claim_type": "external_fact",
      "statement": "The observatory recorded rain at noon.",
      "truth_confidence": 0.9,
      "status": "supported"
    }
  ],
  "evidence": [
    {
      "evidence_id": "evidence:model-said-rain",
      "supports_claim_ids": ["claim:weather"],
      "evidence_type": "model_output",
      "source_ref": {
        "ref_id": "message:fictional:44",
        "kind": "message",
        "locator": "fictional://messages/44",
        "observed_at": "2032-04-05T09:04:00.000Z"
      },
      "observed_at": "2032-04-05T09:04:00.000Z",
      "retrieval_confidence": 1,
      "notes": "This proves only that the fictional model produced the sentence."
    }
  ]
}
